[
    {
        "id": "POL_LIGHT_SHADOW",
        "label": "Luz ↔ Sombra",
        "description": "Polaridade fundamental do psiquismo. Luz representa consciência, clareza e presença; Sombra representa conteúdos reprimidos, distorções e tensões inconscientes.",
        "dimension": "existential",
        "tw_alignment": [
            "3",
            "6",
            "9"
        ]
    },
    {
        "id": "POL_ORDER_CHAOS",
        "label": "Ordem ↔ Caos",
        "description": "Movimento entre estrutura estável e forças disruptivas. Ordem gera previsibilidade; Caos gera ruptura, inovação e mutação.",
        "dimension": "structure",
        "tw_alignment": [
            "3",
            "6"
        ]
    },
    {
        "id": "POL_EXPANSION_CONTRACTION",
        "label": "Expansão ↔ Contração",
        "description": "Dinâmica energética principal da Δ144. Expansão cria abertura, ação e crescimento; Contração cria defesa, proteção e contenção.",
        "dimension": "energy",
        "tw_alignment": [
            "3",
            "6"
        ]
    },
    {
        "id": "POL_METANOIA_STAGNATION",
        "label": "Metanoia ↔ Estagnação",
        "description": "Fluxo evolucionário do sistema. Metanoia é salto de consciência, mudança de eixo e redesign de narrativa; Estagnação é repetição de padrões sem transformação.",
        "dimension": "evolution",
        "tw_alignment": [
            "9"
        ]
    },
    {
        "id": "POL_INDIVIDUAL_COLLECTIVE",
        "label": "Individual ↔ Coletivo",
        "description": "Oscilação entre autonomia, vontade própria e afirmação do eu vs. pertencimento, cultura e identidade de grupo.",
        "dimension": "identity",
        "tw_alignment": [
            "3",
            "9"
        ]
    },
    {
        "id": "POL_CREATION_DESTRUCTION",
        "label": "Criação ↔ Destruição",
        "description": "Polaridade alquímica. Criação inaugura novas estruturas, símbolos e produtos; Destruição remove bloqueios, estruturas mortas e formas obsoletas.",
        "dimension": "alchemical",
        "tw_alignment": [
            "3",
            "6",
            "9"
        ]
    },
    {
        "id": "POL_STABILITY_VOLATILITY",
        "label": "Estabilidade ↔ Volatilidade",
        "description": "Avalia coerência, consistência e ordem emocional vs. oscilação, impulsividade e variação narrativa intensa.",
        "dimension": "affect",
        "tw_alignment": [
            "6"
        ]
    },
    {
        "id": "POL_VISIBILITY_INVISIBILITY",
        "label": "Visível ↔ Invisível",
        "description": "Polaridade entre sinais manifestos, explícitos e rastreáveis vs. forças sutis, latentes e não declaradas que operam no sistema.",
        "dimension": "presence",
        "tw_alignment": [
            "9"
        ]
    },
    {
        "id": "POL_RATIONAL_MYTHIC",
        "label": "Racional ↔ Mítico",
        "description": "Racional opera com lógica, análise e sequência; Mítico opera com símbolos, arquétipos, narrativas fundantes e leitura profunda da realidade.",
        "dimension": "cognition",
        "tw_alignment": [
            "3",
            "9"
        ]
    },
    {
        "id": "POL_CONTROL_SURRENDER",
        "label": "Controle ↔ Entrega",
        "description": "Tensão entre dirigir, governar e impor forma vs. permitir fluxo, ajustar-se à realidade e confiar na dinâmica do sistema.",
        "dimension": "will",
        "tw_alignment": [
            "6",
            "9"
        ]
    },
    {
        "id": "POL_MEANING_VOID",
        "label": "Sentido ↔ Vazio",
        "description": "Avalia a densidade de propósito. Sentido é coerência existencial; Vazio é niilismo, ausência de narrativa ou colapso de significado.",
        "dimension": "existential",
        "tw_alignment": [
            "9"
        ]
    },
    {
        "id": "POL_HOPE_DESPAIR",
        "label": "Esperança ↔ Desespero",
        "description": "Esperança projeta futuros possíveis e mobiliza energia; Desespero colapsa o horizonte e bloqueia ação.",
        "dimension": "existential",
        "tw_alignment": [
            "3",
            "9"
        ]
    },
    {
        "id": "POL_PRESENCE_ABSENCE",
        "label": "Presença ↔ Ausência",
        "description": "Presença é atenção encarnada, participação real; Ausência é desligamento, fuga, desengajamento da cena simbólica.",
        "dimension": "presence",
        "tw_alignment": [
            "3",
            "9"
        ]
    },
    {
        "id": "POL_FLOW_BLOCK",
        "label": "Fluxo ↔ Bloqueio",
        "description": "Fluxo é circulação livre de energia, informação e afeto; Bloqueio é estagnação, travamento ou gargalo estrutural.",
        "dimension": "energy",
        "tw_alignment": [
            "3",
            "6"
        ]
    },
    {
        "id": "POL_DRIVE_APATHY",
        "label": "Impulso ↔ Apatia",
        "description": "Impulso é vontade ativa e movimento; Apatia é desinteresse, inércia e perda de força motivacional.",
        "dimension": "energy",
        "tw_alignment": [
            "3",
            "6"
        ]
    },
    {
        "id": "POL_AUTHENTICITY_COMPLIANCE",
        "label": "Autenticidade ↔ Conformismo",
        "description": "Autenticidade é expressão verdadeira do self; Conformismo é adaptação mecânica às normas externas, mesmo contra o próprio eixo.",
        "dimension": "identity",
        "tw_alignment": [
            "3",
            "9"
        ]
    },
    {
        "id": "POL_AUTONOMY_DEPENDENCE",
        "label": "Autonomia ↔ Dependência",
        "description": "Autonomia decide, escolhe e assume riscos; Dependência transfere decisão e responsabilidade para outros.",
        "dimension": "identity",
        "tw_alignment": [
            "3",
            "6"
        ]
    },
    {
        "id": "POL_ROOTEDNESS_DISPLACEMENT",
        "label": "Enraizamento ↔ Deslocamento",
        "description": "Enraizamento é ter base, lugar e pertença; Deslocamento é sensação de não-lugar, exílio ou desenraizamento simbólico.",
        "dimension": "identity",
        "tw_alignment": [
            "9"
        ]
    },
    {
        "id": "POL_TRUST_SUSPICION",
        "label": "Confiança ↔ Suspeita",
        "description": "Confiança é abertura relacional, crédito simbólico; Suspeita é vigilância, dúvida e leitura constante de ameaça.",
        "dimension": "affect",
        "tw_alignment": [
            "3",
            "6"
        ]
    },
    {
        "id": "POL_CONNECTION_ISOLATION",
        "label": "Conexão ↔ Isolamento",
        "description": "Conexão é vínculo ativo, diálogo e troca; Isolamento é corte de laços, retração e solidão simbólica.",
        "dimension": "affect",
        "tw_alignment": [
            "3",
            "9"
        ]
    },
    {
        "id": "POL_OPENNESS_REPRESSION",
        "label": "Abertura ↔ Repressão",
        "description": "Abertura é disponibilidade para sentir, falar e escutar; Repressão é contenção rígida de afeto, desejo e vulnerabilidade.",
        "dimension": "affect",
        "tw_alignment": [
            "6"
        ]
    },
    {
        "id": "POL_COURAGE_FEAR",
        "label": "Coragem ↔ Medo",
        "description": "Coragem se aproxima daquilo que ameaça, mas é necessário; Medo paralisa, adia ou evita o encontro com o real.",
        "dimension": "affect",
        "tw_alignment": [
            "3",
            "6"
        ]
    },
    {
        "id": "POL_CALM_ANXIETY",
        "label": "Calma ↔ Ansiedade",
        "description": "Calma é regulação fisiológica e narrativa; Ansiedade é antecipação de ameaça, aceleração interna e ruído mental.",
        "dimension": "affect",
        "tw_alignment": [
            "6"
        ]
    },
    {
        "id": "POL_COMPASSION_INDIFFERENCE",
        "label": "Compaixão ↔ Indiferença",
        "description": "Compaixão reconhece a dor do outro e se mobiliza; Indiferença desliga a empatia e trata o outro como ruído.",
        "dimension": "affect",
        "tw_alignment": [
            "3",
            "9"
        ]
    },
    {
        "id": "POL_ANALYSIS_INTUITION",
        "label": "Análise ↔ Intuição",
        "description": "Análise decompõe, mede e compara; Intuição capta o todo, padrões e campos simbólicos de forma direta.",
        "dimension": "cognition",
        "tw_alignment": [
            "3",
            "9"
        ]
    },
    {
        "id": "POL_FOCUS_DISPERSION",
        "label": "Foco ↔ Dispersão",
        "description": "Foco concentra energia em poucos alvos; Dispersão espalha atenção em muitos vetores sem profundidade.",
        "dimension": "cognition",
        "tw_alignment": [
            "3",
            "6"
        ]
    },
    {
        "id": "POL_CONVERGENT_DIVERGENT",
        "label": "Convergente ↔ Divergente",
        "description": "Pensamento convergente busca uma resposta; Divergente abre múltiplas possibilidades e caminhos.",
        "dimension": "cognition",
        "tw_alignment": [
            "3",
            "9"
        ]
    },
    {
        "id": "POL_LITERAL_SYMBOLIC",
        "label": "Literal ↔ Simbólico",
        "description": "Literal lê o texto na superfície; Simbólico lê camadas, metáforas, arquétipos e implicações profundas.",
        "dimension": "cognition",
        "tw_alignment": [
            "9"
        ]
    },
    {
        "id": "POL_CERTAINTY_DOUBT",
        "label": "Certeza ↔ Dúvida",
        "description": "Certeza fixa a narrativa e reduz ambiguidade; Dúvida reabre questões, investiga e tolera o não saber.",
        "dimension": "cognition",
        "tw_alignment": [
            "3",
            "6"
        ]
    },
    {
        "id": "POL_CENTER_PERIPHERY",
        "label": "Centro ↔ Periferia",
        "description": "Centro concentra poder, recursos e atenção; Periferia opera à margem, com menos visibilidade, porém mais liberdade de mutação.",
        "dimension": "structure",
        "tw_alignment": [